<?xml version="1.0" encoding="UTF-8"?>
<!DOCTYPE project-record SYSTEM "file:/C:/Users/Duka_/Desktop/PLC/PRI/TPC/TPC2/pr.dtd">
<project-record>
    <info>
        <key-name></key-name>
        <title></title>
        <subtitle></subtitle>
        <begin-date></begin-date>
        <end-date></end-date>
        <supervisor link=""></supervisor>
    </info>
    <work-team>
        <member link=""></member>
    </work-team>
    <abstract>
        <paragraph></paragraph>
    </abstract>
    <deliverables>
        <deliverable link=""></deliverable>
    </deliverables>
</project-record>